<?xml version="1.0" encoding="UTF-8"?>

<!ELEMENT XY_orarend (ora*)>

<!ELEMENT ora (targy, idopont, helyszin, oktato, szak)>
<!ATTLIST ora id ID #REQUIRED>
<!ATTLIST ora tipus (eloadas | gyakorlat) #REQUIRED>

<!ELEMENT targy (#PCDATA)>

<!ELEMENT idopont (nap, tol, ig)>
<!ELEMENT nap (#PCDATA)>
<!ELEMENT tol (#PCDATA)>
<!ELEMENT ig (#PCDATA)>

<!ELEMENT helyszin (#PCDATA)>
<!ELEMENT oktato (#PCDATA)>
<!ELEMENT szak (#PCDATA)>